{
  "jobId": 13,
  "jobKey": "11111111-1111-4111-8111-111111111113",
  "runId": 130,
  "topicId": 131,
  "leaseOwner": "worker-fixture",
  "leaseExpiresAt": "2026-06-30T12:10:00Z",
  "providerName": "codex-sdk",
  "promptVersion": "prompt-v1",
  "schemaVersion": "automation-job-v2",
  "prompt": "Create a cited draft from the supplied snapshots.",
  "snapshots": [
    {
      "snapshotId": 1,
      "sourceUrl": "https://example.test/source",
      "canonicalUrl": "https://example.test/source",
      "title": "Fixture source",
      "originHost": "example.test",
      "bodyExcerpt": "Fixture evidence.",
      "contentHash": "aaaaaaaaaaaaaaaaaaaaaaaaaaaaaaaaaaaaaaaaaaaaaaaaaaaaaaaaaaaaaaaa",
      "retrievedAt": "2026-06-30T12:00:00Z"
    }
  ]
}
